{
  "$schema": "https://json-schema.org/draft/2020-12/schema",
  "$id": "https://media-monitor/contracts/news_piece_brief.v1.json",
  "title": "news_piece_brief.v1",
  "description": "Experimental structured editorial brief generated from PF seed ideas and digest mappings.",
  "type": "object",
  "additionalProperties": false,
  "properties": {
    "schema_name": {
      "const": "news_piece_brief.v1"
    },
    "schema_status": {
      "const": "experimental_structured"
    },
    "brief_id": {
      "type": "string",
      "minLength": 1
    },
    "digest_id_hour": {
      "type": "string",
      "minLength": 1
    },
    "digest_group_id": {
      "type": "string",
      "minLength": 1
    },
    "digest_file": {
      "type": "string",
      "minLength": 1
    },
    "topic": {
      "type": "string",
      "minLength": 1
    },
    "working_title": {
      "type": "string",
      "minLength": 1
    },
    "angle": {
      "type": "string",
      "minLength": 1
    },
    "key_facts": {
      "type": "array",
      "items": {
        "type": "string",
        "minLength": 1
      }
    },
    "potential_controversies": {
      "type": "array",
      "items": {
        "type": "string",
        "minLength": 1
      }
    },
    "relevant_quotes": {
      "type": "array",
      "items": {
        "type": "string",
        "minLength": 1
      }
    },
    "source_index_ids": {
      "type": "array",
      "items": {
        "type": "string",
        "minLength": 1
      },
      "minItems": 1
    },
    "source_refs": {
      "type": "array",
      "items": {
        "type": "object",
        "additionalProperties": false,
        "properties": {
          "index_id": {
            "type": "string",
            "minLength": 1
          },
          "article_id": {
            "type": "string",
            "minLength": 1
          },
          "title": {
            "type": "string",
            "minLength": 1
          },
          "source": {
            "type": "string",
            "minLength": 1
          },
          "url": {
            "type": "string",
            "minLength": 1
          }
        },
        "required": [
          "index_id",
          "article_id",
          "title",
          "source",
          "url"
        ]
      },
      "minItems": 1
    },
    "meta": {
      "type": "object",
      "additionalProperties": true,
      "properties": {
        "idea_id": {
          "type": "string"
        },
        "group_no": {
          "type": "string"
        }
      }
    }
  },
  "required": [
    "schema_name",
    "schema_status",
    "brief_id",
    "digest_id_hour",
    "digest_group_id",
    "digest_file",
    "topic",
    "working_title",
    "angle",
    "key_facts",
    "potential_controversies",
    "relevant_quotes",
    "source_index_ids",
    "source_refs",
    "meta"
  ]
}
