{
  "schema_name": "news_piece_brief.v1",
  "schema_status": "experimental_structured",
  "brief_id": "npb_9bb6b0f460d95cab",
  "digest_id_hour": "20260314T17",
  "digest_group_id": "20260314T17::A::Economia::01",
  "digest_file": "A_20260314T1700",
  "topic": "Economia",
  "working_title": "Inflación: señales de desaceleración y su impacto",
  "angle": "La convergencia de notas permite explicar efectos sobre consumo y crédito.",
  "key_facts": [
    "La inflación mensual mostró desaceleración en el último corte.",
    "Las tasas de referencia se mantienen en revisión."
  ],
  "potential_controversies": [
    "Si la desaceleración es sostenible en próximos meses."
  ],
  "relevant_quotes": [
    "Analistas advierten sobre riesgos de segunda ronda."
  ],
  "source_index_ids": ["abc12345", "def67890"],
  "source_refs": [
    {
      "index_id": "abc12345",
      "article_id": "42",
      "title": "Inflación baja en diciembre",
      "source": "Fuente A",
      "url": "https://example.com/inflacion-baja"
    },
    {
      "index_id": "def67890",
      "article_id": "73",
      "title": "El banco central recorta tasas",
      "source": "Fuente B",
      "url": "https://example.com/bcra-tasas"
    }
  ],
  "meta": {
    "idea_id": "EC01",
    "group_no": "01"
  }
}
